{
  "archive_dir": "governance/pr_visual_status_archive/grandchallenge/MATH-PROGRAMME/pr-2997/PRVSR-LIVE-PR2997-12a11569f89a-20261101222356",
  "artifacts": {
    "report.json": {
      "path": "governance/pr_visual_status_archive/grandchallenge/MATH-PROGRAMME/pr-2997/PRVSR-LIVE-PR2997-12a11569f89a-20261101222356/report.json",
      "sha256": "74ba0bf855761b51ccbd15b69d9a7c7bb0c3644b6feefb297cee0814e7b12360"
    },
    "report.svg": {
      "path": "governance/pr_visual_status_archive/grandchallenge/MATH-PROGRAMME/pr-2997/PRVSR-LIVE-PR2997-12a11569f89a-20261101222356/report.svg",
      "sha256": "ac8a9ab78c601fd77bea128e0f978b1231bef839fe5a402bb8c4bb230d37e58d"
    },
    "report.txt": {
      "path": "governance/pr_visual_status_archive/grandchallenge/MATH-PROGRAMME/pr-2997/PRVSR-LIVE-PR2997-12a11569f89a-20261101222356/report.txt",
      "sha256": "e0e5ac88953847a6d0e566725503869696c7a33d2ed38cae95ec56431905fa72"
    }
  },
  "authority_boundary": {
    "advisory_only": true,
    "new_merge_gate": false,
    "propagation_authority_created": false,
    "visual_is_authoritative": false
  },
  "exact_head_sha": "12a11569f89a98c09eae0200865964eb2bd7a58b",
  "freshness": "CURRENT",
  "operative_state": "CHECKS_PENDING",
  "pr_number": 2997,
  "report_id": "PRVSR-LIVE-PR2997-12a11569f89a-20261101222356",
  "repository": "grandchallenge/MATH-PROGRAMME",
  "schema_version": "1.0.0",
  "source_snapshot_sha256": "6a7116752b55b109589d2e588c37b248b4304c6204932f018c35b075ff854061",
  "target_head_after": "12a11569f89a98c09eae0200865964eb2bd7a58b",
  "target_head_before": "12a11569f89a98c09eae0200865964eb2bd7a58b",
  "target_pr_head_mutated": false,
  "transport_version": "0.1.0-pilot"
}
