{
  "archive_dir": "governance/pr_visual_status_archive/grandchallenge/MATH-PROGRAMME/pr-557/PRVSR-LIVE-PR557-f442a69f8ed6-20260818072625",
  "artifacts": {
    "report.json": {
      "path": "governance/pr_visual_status_archive/grandchallenge/MATH-PROGRAMME/pr-557/PRVSR-LIVE-PR557-f442a69f8ed6-20260818072625/report.json",
      "sha256": "6494d27e3f9a3ccd0f7802040bfa00db400ed47e53ada0754d26a06069dfac54"
    },
    "report.svg": {
      "path": "governance/pr_visual_status_archive/grandchallenge/MATH-PROGRAMME/pr-557/PRVSR-LIVE-PR557-f442a69f8ed6-20260818072625/report.svg",
      "sha256": "a33db034626eb5dad902e50805802927462a3e9185ad718bce0657f6f333af61"
    },
    "report.txt": {
      "path": "governance/pr_visual_status_archive/grandchallenge/MATH-PROGRAMME/pr-557/PRVSR-LIVE-PR557-f442a69f8ed6-20260818072625/report.txt",
      "sha256": "f97cb77f3d45cd47955742dae48f52553ee60f32ef1db6b471b0305ad19f3d5a"
    }
  },
  "authority_boundary": {
    "advisory_only": true,
    "new_merge_gate": false,
    "propagation_authority_created": false,
    "visual_is_authoritative": false
  },
  "exact_head_sha": "f442a69f8ed672bf7b9bfac8ca9d6b2c7d24a36e",
  "freshness": "CURRENT",
  "operative_state": "CHECKS_PENDING",
  "pr_number": 557,
  "report_id": "PRVSR-LIVE-PR557-f442a69f8ed6-20260818072625",
  "repository": "grandchallenge/MATH-PROGRAMME",
  "schema_version": "1.0.0",
  "source_snapshot_sha256": "e995c6429e7c96df8894e9d2437f490c236ea331c60301132819b8d34cdd1b94",
  "target_head_after": "f442a69f8ed672bf7b9bfac8ca9d6b2c7d24a36e",
  "target_head_before": "f442a69f8ed672bf7b9bfac8ca9d6b2c7d24a36e",
  "target_pr_head_mutated": false,
  "transport_version": "0.1.0-pilot"
}
