{
  "archive_dir": "governance/pr_visual_status_archive/grandchallenge/MATH-PROGRAMME/pr-972/PRVSR-LIVE-PR972-787c67654083-20260914121523",
  "artifacts": {
    "report.json": {
      "path": "governance/pr_visual_status_archive/grandchallenge/MATH-PROGRAMME/pr-972/PRVSR-LIVE-PR972-787c67654083-20260914121523/report.json",
      "sha256": "3912a0c6f07c3d552f1f1afaeaf31efca1407a9bbd76cbfffbdedf1c462b2fc5"
    },
    "report.svg": {
      "path": "governance/pr_visual_status_archive/grandchallenge/MATH-PROGRAMME/pr-972/PRVSR-LIVE-PR972-787c67654083-20260914121523/report.svg",
      "sha256": "51706b69f9afb7b6cc13b2899aa4b55fe97ec7c6588a697ad59ca8b7ba7949c8"
    },
    "report.txt": {
      "path": "governance/pr_visual_status_archive/grandchallenge/MATH-PROGRAMME/pr-972/PRVSR-LIVE-PR972-787c67654083-20260914121523/report.txt",
      "sha256": "f02b459fcbca56c94a9d6aed0fb9a86b39d57656ba5fc82149182cf9c09bbd6a"
    }
  },
  "authority_boundary": {
    "advisory_only": true,
    "new_merge_gate": false,
    "propagation_authority_created": false,
    "visual_is_authoritative": false
  },
  "exact_head_sha": "787c67654083224d1784413cc3a4b1aa946472bb",
  "freshness": "CURRENT",
  "operative_state": "CHECKS_PENDING",
  "pr_number": 972,
  "report_id": "PRVSR-LIVE-PR972-787c67654083-20260914121523",
  "repository": "grandchallenge/MATH-PROGRAMME",
  "schema_version": "1.0.0",
  "source_snapshot_sha256": "020657add363dd59b3ce53f736a98a074fcc1446490376e4a662924569b07b8e",
  "target_head_after": "787c67654083224d1784413cc3a4b1aa946472bb",
  "target_head_before": "787c67654083224d1784413cc3a4b1aa946472bb",
  "target_pr_head_mutated": false,
  "transport_version": "0.1.0-pilot"
}
