{
  "archive_dir": "governance/pr_visual_status_archive/grandchallenge/MATH-PROGRAMME/pr-878/PRVSR-LIVE-PR878-50182558c1df-20260907004408",
  "artifacts": {
    "report.json": {
      "path": "governance/pr_visual_status_archive/grandchallenge/MATH-PROGRAMME/pr-878/PRVSR-LIVE-PR878-50182558c1df-20260907004408/report.json",
      "sha256": "6c67ca632614f374f9a40a09943b1ead91ad303c2b69aa3ad2fdb0311bc8ede6"
    },
    "report.svg": {
      "path": "governance/pr_visual_status_archive/grandchallenge/MATH-PROGRAMME/pr-878/PRVSR-LIVE-PR878-50182558c1df-20260907004408/report.svg",
      "sha256": "802a98d6efc78decd641747e6786274d47e2aa75de193c6e3b3e6de5e32ad7b6"
    },
    "report.txt": {
      "path": "governance/pr_visual_status_archive/grandchallenge/MATH-PROGRAMME/pr-878/PRVSR-LIVE-PR878-50182558c1df-20260907004408/report.txt",
      "sha256": "3aa3a2f152a7a9b05bf7f62282d37066d2cdf11aac18ca0a94f7dc4e4b88ad82"
    }
  },
  "authority_boundary": {
    "advisory_only": true,
    "new_merge_gate": false,
    "propagation_authority_created": false,
    "visual_is_authoritative": false
  },
  "exact_head_sha": "50182558c1df0a90344f76a8006667e3ddc0fa54",
  "freshness": "CURRENT",
  "operative_state": "BLOCKED",
  "pr_number": 878,
  "report_id": "PRVSR-LIVE-PR878-50182558c1df-20260907004408",
  "repository": "grandchallenge/MATH-PROGRAMME",
  "schema_version": "1.0.0",
  "source_snapshot_sha256": "2fdcb85bc4f7c16e0a6cca520d88f2393a0e4f5d35f3529df66f93186b3301db",
  "target_head_after": "50182558c1df0a90344f76a8006667e3ddc0fa54",
  "target_head_before": "50182558c1df0a90344f76a8006667e3ddc0fa54",
  "target_pr_head_mutated": false,
  "transport_version": "0.1.0-pilot"
}
