{
  "archive_dir": "governance/pr_visual_status_archive/grandchallenge/MATH-PROGRAMME/pr-798/PRVSR-LIVE-PR798-45ca586bc198-20260903093612",
  "artifacts": {
    "report.json": {
      "path": "governance/pr_visual_status_archive/grandchallenge/MATH-PROGRAMME/pr-798/PRVSR-LIVE-PR798-45ca586bc198-20260903093612/report.json",
      "sha256": "61caf30faaa0200c4168406d99b0366f9c753cd6457ddf4242edf653e9023e01"
    },
    "report.svg": {
      "path": "governance/pr_visual_status_archive/grandchallenge/MATH-PROGRAMME/pr-798/PRVSR-LIVE-PR798-45ca586bc198-20260903093612/report.svg",
      "sha256": "a76ee20970c06477ecfe876c239379cd1808038928fef502fabf206d3824c7cf"
    },
    "report.txt": {
      "path": "governance/pr_visual_status_archive/grandchallenge/MATH-PROGRAMME/pr-798/PRVSR-LIVE-PR798-45ca586bc198-20260903093612/report.txt",
      "sha256": "699566982cf107b09d0de0c2a21d12b098df54530583a0215b6d60efe94e7ab9"
    }
  },
  "authority_boundary": {
    "advisory_only": true,
    "new_merge_gate": false,
    "propagation_authority_created": false,
    "visual_is_authoritative": false
  },
  "exact_head_sha": "45ca586bc198dd9c9ef066a391ae2b0e3a43b972",
  "freshness": "CURRENT",
  "operative_state": "CHECKS_PENDING",
  "pr_number": 798,
  "report_id": "PRVSR-LIVE-PR798-45ca586bc198-20260903093612",
  "repository": "grandchallenge/MATH-PROGRAMME",
  "schema_version": "1.0.0",
  "source_snapshot_sha256": "ec7fbe7e7c268d404f6a251dbbd84d472c0b45d9d0bfeaf7c78721410fc4f48e",
  "target_head_after": "45ca586bc198dd9c9ef066a391ae2b0e3a43b972",
  "target_head_before": "45ca586bc198dd9c9ef066a391ae2b0e3a43b972",
  "target_pr_head_mutated": false,
  "transport_version": "0.1.0-pilot"
}
