{
  "archive_dir": "governance/pr_visual_status_archive/grandchallenge/MATH-PROGRAMME/pr-1169/PRVSR-LIVE-PR1169-1958e5fa2ee8-20261003114711",
  "artifacts": {
    "report.json": {
      "path": "governance/pr_visual_status_archive/grandchallenge/MATH-PROGRAMME/pr-1169/PRVSR-LIVE-PR1169-1958e5fa2ee8-20261003114711/report.json",
      "sha256": "e94b20a22ffb7f2dbff8ed680e7e5b679566b3aed88ecd6cf418866218d3a76e"
    },
    "report.svg": {
      "path": "governance/pr_visual_status_archive/grandchallenge/MATH-PROGRAMME/pr-1169/PRVSR-LIVE-PR1169-1958e5fa2ee8-20261003114711/report.svg",
      "sha256": "877c7239e4bfa85eb9ddea85c7973569236da659e428933dde2b00573feeb214"
    },
    "report.txt": {
      "path": "governance/pr_visual_status_archive/grandchallenge/MATH-PROGRAMME/pr-1169/PRVSR-LIVE-PR1169-1958e5fa2ee8-20261003114711/report.txt",
      "sha256": "84cbf344524e2d456a16f265f62fbc556e1979b345ff23df4636f71f8110ac87"
    }
  },
  "authority_boundary": {
    "advisory_only": true,
    "new_merge_gate": false,
    "propagation_authority_created": false,
    "visual_is_authoritative": false
  },
  "exact_head_sha": "1958e5fa2ee8ed905b8e9e06012c0dc3359463ac",
  "freshness": "CURRENT",
  "operative_state": "CHECKS_PENDING",
  "pr_number": 1169,
  "report_id": "PRVSR-LIVE-PR1169-1958e5fa2ee8-20261003114711",
  "repository": "grandchallenge/MATH-PROGRAMME",
  "schema_version": "1.0.0",
  "source_snapshot_sha256": "312f7073ea7fd4a293448d8d1a20e9414fe69a7ea6854be75eb9609f04d253df",
  "target_head_after": "1958e5fa2ee8ed905b8e9e06012c0dc3359463ac",
  "target_head_before": "1958e5fa2ee8ed905b8e9e06012c0dc3359463ac",
  "target_pr_head_mutated": false,
  "transport_version": "0.1.0-pilot"
}
