{
  "archive_dir": "governance/pr_visual_status_archive/grandchallenge/MATH-PROGRAMME/pr-729/PRVSR-LIVE-PR729-8aba3f4dfc29-20260901021403",
  "artifacts": {
    "report.json": {
      "path": "governance/pr_visual_status_archive/grandchallenge/MATH-PROGRAMME/pr-729/PRVSR-LIVE-PR729-8aba3f4dfc29-20260901021403/report.json",
      "sha256": "dddb9114f2100fbdd5be55994a699267bea29f900b6e3062e84b6e28795c0691"
    },
    "report.svg": {
      "path": "governance/pr_visual_status_archive/grandchallenge/MATH-PROGRAMME/pr-729/PRVSR-LIVE-PR729-8aba3f4dfc29-20260901021403/report.svg",
      "sha256": "9ff4e346e5bb486032d10a553c72c56abfafd6129af27bd9567be098aff1c492"
    },
    "report.txt": {
      "path": "governance/pr_visual_status_archive/grandchallenge/MATH-PROGRAMME/pr-729/PRVSR-LIVE-PR729-8aba3f4dfc29-20260901021403/report.txt",
      "sha256": "b03ddb5b0f4ed49b4e896003bbc87a2b3a75e6407d8ca1d48e482b52a3406dcf"
    }
  },
  "authority_boundary": {
    "advisory_only": true,
    "new_merge_gate": false,
    "propagation_authority_created": false,
    "visual_is_authoritative": false
  },
  "exact_head_sha": "8aba3f4dfc29042ad5177e168ee7610cc78cd209",
  "freshness": "CURRENT",
  "operative_state": "UNKNOWN",
  "pr_number": 729,
  "report_id": "PRVSR-LIVE-PR729-8aba3f4dfc29-20260901021403",
  "repository": "grandchallenge/MATH-PROGRAMME",
  "schema_version": "1.0.0",
  "source_snapshot_sha256": "75aecc7aa2d290fe8c1aa433082c1b7227bab48966091a54f3f053430ee880e9",
  "target_head_after": "8aba3f4dfc29042ad5177e168ee7610cc78cd209",
  "target_head_before": "8aba3f4dfc29042ad5177e168ee7610cc78cd209",
  "target_pr_head_mutated": false,
  "transport_version": "0.1.0-pilot"
}
