{
  "archive_dir": "governance/pr_visual_status_archive/grandchallenge/MATH-PROGRAMME/pr-561/PRVSR-LIVE-PR561-4c37aadaa596-20260818100557",
  "artifacts": {
    "report.json": {
      "path": "governance/pr_visual_status_archive/grandchallenge/MATH-PROGRAMME/pr-561/PRVSR-LIVE-PR561-4c37aadaa596-20260818100557/report.json",
      "sha256": "997e24cbc2681467a9a425aa916732d296ace2abbbca84288369a073367e9032"
    },
    "report.svg": {
      "path": "governance/pr_visual_status_archive/grandchallenge/MATH-PROGRAMME/pr-561/PRVSR-LIVE-PR561-4c37aadaa596-20260818100557/report.svg",
      "sha256": "c92595de1359f3c9b41e0f993090a161b9f3e6c3e17bfcad6aa00c74ebca35ca"
    },
    "report.txt": {
      "path": "governance/pr_visual_status_archive/grandchallenge/MATH-PROGRAMME/pr-561/PRVSR-LIVE-PR561-4c37aadaa596-20260818100557/report.txt",
      "sha256": "9419f52302536628fab5b5fc62d3fd2ca796069615778e000cdb8425e909c1c0"
    }
  },
  "authority_boundary": {
    "advisory_only": true,
    "new_merge_gate": false,
    "propagation_authority_created": false,
    "visual_is_authoritative": false
  },
  "exact_head_sha": "4c37aadaa5969a530b94a97541a9e9e1552b755f",
  "freshness": "CURRENT",
  "operative_state": "UNKNOWN",
  "pr_number": 561,
  "report_id": "PRVSR-LIVE-PR561-4c37aadaa596-20260818100557",
  "repository": "grandchallenge/MATH-PROGRAMME",
  "schema_version": "1.0.0",
  "source_snapshot_sha256": "cb6a7ba432e25a80a3a45a57a12dec15aacca5377ba5604efee01ef9950244b1",
  "target_head_after": "4c37aadaa5969a530b94a97541a9e9e1552b755f",
  "target_head_before": "4c37aadaa5969a530b94a97541a9e9e1552b755f",
  "target_pr_head_mutated": false,
  "transport_version": "0.1.0-pilot"
}
