{
  "archive_dir": "governance/pr_visual_status_archive/grandchallenge/MATH-PROGRAMME/pr-601/PRVSR-LIVE-PR601-166bc9b59cdd-20260820215049",
  "artifacts": {
    "report.json": {
      "path": "governance/pr_visual_status_archive/grandchallenge/MATH-PROGRAMME/pr-601/PRVSR-LIVE-PR601-166bc9b59cdd-20260820215049/report.json",
      "sha256": "f69151b39aa585012b812f3dbcc9559922948d890b815fd03a661fe805095e80"
    },
    "report.svg": {
      "path": "governance/pr_visual_status_archive/grandchallenge/MATH-PROGRAMME/pr-601/PRVSR-LIVE-PR601-166bc9b59cdd-20260820215049/report.svg",
      "sha256": "58f66004130c13bef4439e08fd6f4a811674ca1acf8ca55dd4e4ca7e7369e9c1"
    },
    "report.txt": {
      "path": "governance/pr_visual_status_archive/grandchallenge/MATH-PROGRAMME/pr-601/PRVSR-LIVE-PR601-166bc9b59cdd-20260820215049/report.txt",
      "sha256": "d229e713636ad6f90c7444a382844642a5f838af52412a42755dff4bd5ce3df9"
    }
  },
  "authority_boundary": {
    "advisory_only": true,
    "new_merge_gate": false,
    "propagation_authority_created": false,
    "visual_is_authoritative": false
  },
  "exact_head_sha": "166bc9b59cddc2688f3d154a122fed5abed01776",
  "freshness": "CURRENT",
  "operative_state": "CHECKS_PENDING",
  "pr_number": 601,
  "report_id": "PRVSR-LIVE-PR601-166bc9b59cdd-20260820215049",
  "repository": "grandchallenge/MATH-PROGRAMME",
  "schema_version": "1.0.0",
  "source_snapshot_sha256": "c9d8d2d7b0d4272d2d1fcea6fd5cf69ee992395fb36c0eb6879159bd3aaf2529",
  "target_head_after": "166bc9b59cddc2688f3d154a122fed5abed01776",
  "target_head_before": "166bc9b59cddc2688f3d154a122fed5abed01776",
  "target_pr_head_mutated": false,
  "transport_version": "0.1.0-pilot"
}
