{
  "archive_dir": "governance/pr_visual_status_archive/grandchallenge/MATH-PROGRAMME/pr-606/PRVSR-LIVE-PR606-a6934290c30a-20260819205251",
  "artifacts": {
    "report.json": {
      "path": "governance/pr_visual_status_archive/grandchallenge/MATH-PROGRAMME/pr-606/PRVSR-LIVE-PR606-a6934290c30a-20260819205251/report.json",
      "sha256": "5630756de591529ac934cb25f2f3b2811a9236f8c2449a394536b0201beca3c8"
    },
    "report.svg": {
      "path": "governance/pr_visual_status_archive/grandchallenge/MATH-PROGRAMME/pr-606/PRVSR-LIVE-PR606-a6934290c30a-20260819205251/report.svg",
      "sha256": "0f6d8ba10b6ba5cdfc87ef05422d28a7f17875772d89f1880a11ae8036d05ec5"
    },
    "report.txt": {
      "path": "governance/pr_visual_status_archive/grandchallenge/MATH-PROGRAMME/pr-606/PRVSR-LIVE-PR606-a6934290c30a-20260819205251/report.txt",
      "sha256": "699922b67c17549e3f1d84fbd7dca0533f348c97c44b42c7243c5b5e6cf47fd8"
    }
  },
  "authority_boundary": {
    "advisory_only": true,
    "new_merge_gate": false,
    "propagation_authority_created": false,
    "visual_is_authoritative": false
  },
  "exact_head_sha": "a6934290c30aabbf391c14bd6ce79f5060e498e5",
  "freshness": "CURRENT",
  "operative_state": "CHECKS_PENDING",
  "pr_number": 606,
  "report_id": "PRVSR-LIVE-PR606-a6934290c30a-20260819205251",
  "repository": "grandchallenge/MATH-PROGRAMME",
  "schema_version": "1.0.0",
  "source_snapshot_sha256": "928577743ab5bb1dcac23665596c38d07f8c3febc5098794dbae05e5750ee1b8",
  "target_head_after": "a6934290c30aabbf391c14bd6ce79f5060e498e5",
  "target_head_before": "a6934290c30aabbf391c14bd6ce79f5060e498e5",
  "target_pr_head_mutated": false,
  "transport_version": "0.1.0-pilot"
}
