{
  "archive_dir": "governance/pr_visual_status_archive/grandchallenge/MATH-PROGRAMME/pr-1237/PRVSR-LIVE-PR1237-4591fcfe23f1-20261008095702",
  "artifacts": {
    "report.json": {
      "path": "governance/pr_visual_status_archive/grandchallenge/MATH-PROGRAMME/pr-1237/PRVSR-LIVE-PR1237-4591fcfe23f1-20261008095702/report.json",
      "sha256": "3e6533e2825fcefd85057f80cc4827bc013de657435d744216abd1b7ba0369ef"
    },
    "report.svg": {
      "path": "governance/pr_visual_status_archive/grandchallenge/MATH-PROGRAMME/pr-1237/PRVSR-LIVE-PR1237-4591fcfe23f1-20261008095702/report.svg",
      "sha256": "f14faf97883e96b2757d98d53cea0a4ace8bd705677e185800ec3db2ef399e6a"
    },
    "report.txt": {
      "path": "governance/pr_visual_status_archive/grandchallenge/MATH-PROGRAMME/pr-1237/PRVSR-LIVE-PR1237-4591fcfe23f1-20261008095702/report.txt",
      "sha256": "a0e7da2d546fb957f566604b47832d7ec9d1dec7159f75761d29983717d4b9d9"
    }
  },
  "authority_boundary": {
    "advisory_only": true,
    "new_merge_gate": false,
    "propagation_authority_created": false,
    "visual_is_authoritative": false
  },
  "exact_head_sha": "4591fcfe23f10a49f312b5d95b82d159b1b36e66",
  "freshness": "CURRENT",
  "operative_state": "CHECKS_PENDING",
  "pr_number": 1237,
  "report_id": "PRVSR-LIVE-PR1237-4591fcfe23f1-20261008095702",
  "repository": "grandchallenge/MATH-PROGRAMME",
  "schema_version": "1.0.0",
  "source_snapshot_sha256": "964ccf5a51158b188d5caaf7dafb442a8a699d6649a5c7a34aa40fa39600839e",
  "target_head_after": "4591fcfe23f10a49f312b5d95b82d159b1b36e66",
  "target_head_before": "4591fcfe23f10a49f312b5d95b82d159b1b36e66",
  "target_pr_head_mutated": false,
  "transport_version": "0.1.0-pilot"
}
