{
  "archive_dir": "governance/pr_visual_status_archive/grandchallenge/MATH-PROGRAMME/pr-2582/PRVSR-LIVE-PR2582-b3a1bc9a8076-20261012012835",
  "artifacts": {
    "report.json": {
      "path": "governance/pr_visual_status_archive/grandchallenge/MATH-PROGRAMME/pr-2582/PRVSR-LIVE-PR2582-b3a1bc9a8076-20261012012835/report.json",
      "sha256": "ab54cc17338a1c2cc3cdf6accc827fbf972b6d0f629497d4fe26df968b2aab78"
    },
    "report.svg": {
      "path": "governance/pr_visual_status_archive/grandchallenge/MATH-PROGRAMME/pr-2582/PRVSR-LIVE-PR2582-b3a1bc9a8076-20261012012835/report.svg",
      "sha256": "55a5e8da3987878c2e719f3c14a8a51544a86780060cb098fc3ce3a5f024ae9b"
    },
    "report.txt": {
      "path": "governance/pr_visual_status_archive/grandchallenge/MATH-PROGRAMME/pr-2582/PRVSR-LIVE-PR2582-b3a1bc9a8076-20261012012835/report.txt",
      "sha256": "3979711916586482199b601501070fdf5c0b5325a14b686c4ddfca5665a0106b"
    }
  },
  "authority_boundary": {
    "advisory_only": true,
    "new_merge_gate": false,
    "propagation_authority_created": false,
    "visual_is_authoritative": false
  },
  "exact_head_sha": "b3a1bc9a80766a2bf40737df324d129744c41b64",
  "freshness": "CURRENT",
  "operative_state": "BLOCKED",
  "pr_number": 2582,
  "report_id": "PRVSR-LIVE-PR2582-b3a1bc9a8076-20261012012835",
  "repository": "grandchallenge/MATH-PROGRAMME",
  "schema_version": "1.0.0",
  "source_snapshot_sha256": "25a625275649488de510fcaac52fd76d0b8893b418194c0ef0709b466d7d6cc1",
  "target_head_after": "b3a1bc9a80766a2bf40737df324d129744c41b64",
  "target_head_before": "b3a1bc9a80766a2bf40737df324d129744c41b64",
  "target_pr_head_mutated": false,
  "transport_version": "0.1.0-pilot"
}
