{
  "archive_dir": "governance/pr_visual_status_archive/grandchallenge/MATH-PROGRAMME/pr-2540/PRVSR-LIVE-PR2540-29780bea434b-20261011022350",
  "artifacts": {
    "report.json": {
      "path": "governance/pr_visual_status_archive/grandchallenge/MATH-PROGRAMME/pr-2540/PRVSR-LIVE-PR2540-29780bea434b-20261011022350/report.json",
      "sha256": "91c84d4a0221c726ea07eee7640f90097223a9580b14e3e03d93ae5162b8b931"
    },
    "report.svg": {
      "path": "governance/pr_visual_status_archive/grandchallenge/MATH-PROGRAMME/pr-2540/PRVSR-LIVE-PR2540-29780bea434b-20261011022350/report.svg",
      "sha256": "56baa00e0eeb0dcc7767c4b78eeb2de47f25da53648e07750f4b58799796b209"
    },
    "report.txt": {
      "path": "governance/pr_visual_status_archive/grandchallenge/MATH-PROGRAMME/pr-2540/PRVSR-LIVE-PR2540-29780bea434b-20261011022350/report.txt",
      "sha256": "f806273009c8392d4ced199b01abd6364612f66969f4960fb3f6a451ff5fc422"
    }
  },
  "authority_boundary": {
    "advisory_only": true,
    "new_merge_gate": false,
    "propagation_authority_created": false,
    "visual_is_authoritative": false
  },
  "exact_head_sha": "29780bea434bc0d96bdb4728b3a4e070d93f2644",
  "freshness": "CURRENT",
  "operative_state": "CHECKS_PENDING",
  "pr_number": 2540,
  "report_id": "PRVSR-LIVE-PR2540-29780bea434b-20261011022350",
  "repository": "grandchallenge/MATH-PROGRAMME",
  "schema_version": "1.0.0",
  "source_snapshot_sha256": "c872c0ef0dd7363823e16407a9d935d77c6911299b0829770c5f892aebf7d63a",
  "target_head_after": "29780bea434bc0d96bdb4728b3a4e070d93f2644",
  "target_head_before": "29780bea434bc0d96bdb4728b3a4e070d93f2644",
  "target_pr_head_mutated": false,
  "transport_version": "0.1.0-pilot"
}
