{
  "archive_dir": "governance/pr_visual_status_archive/grandchallenge/MATH-PROGRAMME/pr-482/PRVSR-LIVE-PR482-dce575625942-20260813024932",
  "artifacts": {
    "report.json": {
      "path": "governance/pr_visual_status_archive/grandchallenge/MATH-PROGRAMME/pr-482/PRVSR-LIVE-PR482-dce575625942-20260813024932/report.json",
      "sha256": "b53e861dbfbcc5dc5f38d5b0084a511136edbf2074bd45c2dfe459734195b790"
    },
    "report.svg": {
      "path": "governance/pr_visual_status_archive/grandchallenge/MATH-PROGRAMME/pr-482/PRVSR-LIVE-PR482-dce575625942-20260813024932/report.svg",
      "sha256": "637c75e0fb41c6406b2280e76acd9adda337b812d8ddd40b6ed36f6ebd6b8916"
    },
    "report.txt": {
      "path": "governance/pr_visual_status_archive/grandchallenge/MATH-PROGRAMME/pr-482/PRVSR-LIVE-PR482-dce575625942-20260813024932/report.txt",
      "sha256": "27b024d5ec12db03ca6df2dba631b4babdcf624dad14ad718adcf18e8f8d2c6e"
    }
  },
  "authority_boundary": {
    "advisory_only": true,
    "new_merge_gate": false,
    "propagation_authority_created": false,
    "visual_is_authoritative": false
  },
  "exact_head_sha": "dce5756259420d337bbc26df340f34c27f4e3baa",
  "freshness": "CURRENT",
  "operative_state": "CHECKS_PENDING",
  "pr_number": 482,
  "report_id": "PRVSR-LIVE-PR482-dce575625942-20260813024932",
  "repository": "grandchallenge/MATH-PROGRAMME",
  "schema_version": "1.0.0",
  "source_snapshot_sha256": "edd65b6aa9e5b4766b1ada56e41f6b72ecfcaba73e87fbd3dac6d90dd2f7c1a3",
  "target_head_after": "dce5756259420d337bbc26df340f34c27f4e3baa",
  "target_head_before": "dce5756259420d337bbc26df340f34c27f4e3baa",
  "target_pr_head_mutated": false,
  "transport_version": "0.1.0-pilot"
}
