{
  "archive_dir": "governance/pr_visual_status_archive/grandchallenge/MATH-PROGRAMME/pr-2630/PRVSR-LIVE-PR2630-adec53f20780-20261014102842",
  "artifacts": {
    "report.json": {
      "path": "governance/pr_visual_status_archive/grandchallenge/MATH-PROGRAMME/pr-2630/PRVSR-LIVE-PR2630-adec53f20780-20261014102842/report.json",
      "sha256": "cb8e5ea79dbbc9f8d11aac42c225a3cbdbdac15d0ba309e81265e010b0d7b34a"
    },
    "report.svg": {
      "path": "governance/pr_visual_status_archive/grandchallenge/MATH-PROGRAMME/pr-2630/PRVSR-LIVE-PR2630-adec53f20780-20261014102842/report.svg",
      "sha256": "65ce33d255c27ae35dbc2db0c0efcbff074e9a936b89a7352513470c694fa7d2"
    },
    "report.txt": {
      "path": "governance/pr_visual_status_archive/grandchallenge/MATH-PROGRAMME/pr-2630/PRVSR-LIVE-PR2630-adec53f20780-20261014102842/report.txt",
      "sha256": "e3736885d8d514fcea413376c0392acfd38f90823789334c2f2577245e541c9e"
    }
  },
  "authority_boundary": {
    "advisory_only": true,
    "new_merge_gate": false,
    "propagation_authority_created": false,
    "visual_is_authoritative": false
  },
  "exact_head_sha": "adec53f20780b5716511b909fe9a03db50f2542b",
  "freshness": "CURRENT",
  "operative_state": "CHECKS_PENDING",
  "pr_number": 2630,
  "report_id": "PRVSR-LIVE-PR2630-adec53f20780-20261014102842",
  "repository": "grandchallenge/MATH-PROGRAMME",
  "schema_version": "1.0.0",
  "source_snapshot_sha256": "0daac36fd66a13c2866ae63e80b43a12d7ba9b83f9301dcce502cea5ead043d9",
  "target_head_after": "adec53f20780b5716511b909fe9a03db50f2542b",
  "target_head_before": "adec53f20780b5716511b909fe9a03db50f2542b",
  "target_pr_head_mutated": false,
  "transport_version": "0.1.0-pilot"
}
