{
  "archive_dir": "governance/pr_visual_status_archive/grandchallenge/MATH-PROGRAMME/pr-653/PRVSR-LIVE-PR653-267d05b99b2f-20260821193650",
  "artifacts": {
    "report.json": {
      "path": "governance/pr_visual_status_archive/grandchallenge/MATH-PROGRAMME/pr-653/PRVSR-LIVE-PR653-267d05b99b2f-20260821193650/report.json",
      "sha256": "db278722b863c2ae27747c22ae5d3b323144e82c85c4190b57cf9fb38bcc7014"
    },
    "report.svg": {
      "path": "governance/pr_visual_status_archive/grandchallenge/MATH-PROGRAMME/pr-653/PRVSR-LIVE-PR653-267d05b99b2f-20260821193650/report.svg",
      "sha256": "b56ba36a47d8eb77847adc9a09c5a7ac4dad3e96f6076630239114f7fcff59a8"
    },
    "report.txt": {
      "path": "governance/pr_visual_status_archive/grandchallenge/MATH-PROGRAMME/pr-653/PRVSR-LIVE-PR653-267d05b99b2f-20260821193650/report.txt",
      "sha256": "3d8230ef3b80ca112b3d39a26332936dd5177ece421a13f2555321ff0aa7208d"
    }
  },
  "authority_boundary": {
    "advisory_only": true,
    "new_merge_gate": false,
    "propagation_authority_created": false,
    "visual_is_authoritative": false
  },
  "exact_head_sha": "267d05b99b2f6ed52fc3e321e73cdea175462948",
  "freshness": "CURRENT",
  "operative_state": "CHECKS_PENDING",
  "pr_number": 653,
  "report_id": "PRVSR-LIVE-PR653-267d05b99b2f-20260821193650",
  "repository": "grandchallenge/MATH-PROGRAMME",
  "schema_version": "1.0.0",
  "source_snapshot_sha256": "d28093a102dba7284dda452be5e8eb84532d78c0ce44d1dc4c9622e01cb09156",
  "target_head_after": "267d05b99b2f6ed52fc3e321e73cdea175462948",
  "target_head_before": "267d05b99b2f6ed52fc3e321e73cdea175462948",
  "target_pr_head_mutated": false,
  "transport_version": "0.1.0-pilot"
}
