{
  "archive_dir": "governance/pr_visual_status_archive/grandchallenge/MATH-PROGRAMME/pr-413/PRVSR-LIVE-PR413-26c5736e9095-20260818074327",
  "artifacts": {
    "report.json": {
      "path": "governance/pr_visual_status_archive/grandchallenge/MATH-PROGRAMME/pr-413/PRVSR-LIVE-PR413-26c5736e9095-20260818074327/report.json",
      "sha256": "162142af1265cf40fd9e0f86a847f72b83957cf56ef8834b13f7a90c9d186fa9"
    },
    "report.svg": {
      "path": "governance/pr_visual_status_archive/grandchallenge/MATH-PROGRAMME/pr-413/PRVSR-LIVE-PR413-26c5736e9095-20260818074327/report.svg",
      "sha256": "af6d49dc080d37248eb18f8a70835cd1c6d781a8156248376544496158fe6db7"
    },
    "report.txt": {
      "path": "governance/pr_visual_status_archive/grandchallenge/MATH-PROGRAMME/pr-413/PRVSR-LIVE-PR413-26c5736e9095-20260818074327/report.txt",
      "sha256": "fbe091bcd022a4a432f6b54e3e88252e574bfbc29b3a0a6d8f5f2da0f971c44b"
    }
  },
  "authority_boundary": {
    "advisory_only": true,
    "new_merge_gate": false,
    "propagation_authority_created": false,
    "visual_is_authoritative": false
  },
  "exact_head_sha": "26c5736e90954c751fb84eedc6310388d5e09c8d",
  "freshness": "CURRENT",
  "operative_state": "CHECKS_PENDING",
  "pr_number": 413,
  "report_id": "PRVSR-LIVE-PR413-26c5736e9095-20260818074327",
  "repository": "grandchallenge/MATH-PROGRAMME",
  "schema_version": "1.0.0",
  "source_snapshot_sha256": "8955a06e8940428851c72954f4c6001a3ebe8ea5f1c2057d0dcd54257cc8af2c",
  "target_head_after": "26c5736e90954c751fb84eedc6310388d5e09c8d",
  "target_head_before": "26c5736e90954c751fb84eedc6310388d5e09c8d",
  "target_pr_head_mutated": false,
  "transport_version": "0.1.0-pilot"
}
