{
  "archive_dir": "governance/pr_visual_status_archive/grandchallenge/MATH-PROGRAMME/pr-2958/PRVSR-LIVE-PR2958-ef7d01dd164a-20261101003013",
  "artifacts": {
    "report.json": {
      "path": "governance/pr_visual_status_archive/grandchallenge/MATH-PROGRAMME/pr-2958/PRVSR-LIVE-PR2958-ef7d01dd164a-20261101003013/report.json",
      "sha256": "b5c8ba5dc6ccbac0184bda709f3f46a039c6b6590016664f24ca929656aa376a"
    },
    "report.svg": {
      "path": "governance/pr_visual_status_archive/grandchallenge/MATH-PROGRAMME/pr-2958/PRVSR-LIVE-PR2958-ef7d01dd164a-20261101003013/report.svg",
      "sha256": "fd6e2d09dea2f22d39a2bcf9533cdb20e44b7b60f64ab5cd4ee4b22ffb1320b1"
    },
    "report.txt": {
      "path": "governance/pr_visual_status_archive/grandchallenge/MATH-PROGRAMME/pr-2958/PRVSR-LIVE-PR2958-ef7d01dd164a-20261101003013/report.txt",
      "sha256": "ff3364e4eae5ad34db97eb749efd9da174c9cd435a31c8bc795788903a68049f"
    }
  },
  "authority_boundary": {
    "advisory_only": true,
    "new_merge_gate": false,
    "propagation_authority_created": false,
    "visual_is_authoritative": false
  },
  "exact_head_sha": "ef7d01dd164a8db5582f789f2a2355ed69b6c198",
  "freshness": "CURRENT",
  "operative_state": "CHECKS_PENDING",
  "pr_number": 2958,
  "report_id": "PRVSR-LIVE-PR2958-ef7d01dd164a-20261101003013",
  "repository": "grandchallenge/MATH-PROGRAMME",
  "schema_version": "1.0.0",
  "source_snapshot_sha256": "d1fe4d942c20dea11c7d189f4b33c1384f52f956e753e276d51f87741e567246",
  "target_head_after": "ef7d01dd164a8db5582f789f2a2355ed69b6c198",
  "target_head_before": "ef7d01dd164a8db5582f789f2a2355ed69b6c198",
  "target_pr_head_mutated": false,
  "transport_version": "0.1.0-pilot"
}
