{
  "archive_dir": "governance/pr_visual_status_archive/grandchallenge/MATH-PROGRAMME/pr-637/PRVSR-LIVE-PR637-4b1f64420faa-20260820234804",
  "artifacts": {
    "report.json": {
      "path": "governance/pr_visual_status_archive/grandchallenge/MATH-PROGRAMME/pr-637/PRVSR-LIVE-PR637-4b1f64420faa-20260820234804/report.json",
      "sha256": "341f6ca17f35cd55a7125aa40a9a91eb8a07d75730f3c9081b62f1c70fced302"
    },
    "report.svg": {
      "path": "governance/pr_visual_status_archive/grandchallenge/MATH-PROGRAMME/pr-637/PRVSR-LIVE-PR637-4b1f64420faa-20260820234804/report.svg",
      "sha256": "c04d6edae612c0c537af70939a1be1ca3b7c6d5ea95120264915d79ca74185ea"
    },
    "report.txt": {
      "path": "governance/pr_visual_status_archive/grandchallenge/MATH-PROGRAMME/pr-637/PRVSR-LIVE-PR637-4b1f64420faa-20260820234804/report.txt",
      "sha256": "609bd543dbeb58084247b7e9094d41720675f9ab9851da2c6718293a7f822d5a"
    }
  },
  "authority_boundary": {
    "advisory_only": true,
    "new_merge_gate": false,
    "propagation_authority_created": false,
    "visual_is_authoritative": false
  },
  "exact_head_sha": "4b1f64420faa8cbcfd686137491b720f3115eacf",
  "freshness": "CURRENT",
  "operative_state": "CHECKS_PENDING",
  "pr_number": 637,
  "report_id": "PRVSR-LIVE-PR637-4b1f64420faa-20260820234804",
  "repository": "grandchallenge/MATH-PROGRAMME",
  "schema_version": "1.0.0",
  "source_snapshot_sha256": "1e9d5b5e5e454c474d36104db0ef5dda58e441605eb0186a0ae34b9a1a3a04b7",
  "target_head_after": "4b1f64420faa8cbcfd686137491b720f3115eacf",
  "target_head_before": "4b1f64420faa8cbcfd686137491b720f3115eacf",
  "target_pr_head_mutated": false,
  "transport_version": "0.1.0-pilot"
}
