{
  "archive_dir": "governance/pr_visual_status_archive/grandchallenge/MATH-PROGRAMME/pr-561/PRVSR-LIVE-PR561-dc8191ec41b8-20260818085151",
  "artifacts": {
    "report.json": {
      "path": "governance/pr_visual_status_archive/grandchallenge/MATH-PROGRAMME/pr-561/PRVSR-LIVE-PR561-dc8191ec41b8-20260818085151/report.json",
      "sha256": "c2d746a49ca222355b4ab42b4c8406d71a809194daf885a25905d83475975071"
    },
    "report.svg": {
      "path": "governance/pr_visual_status_archive/grandchallenge/MATH-PROGRAMME/pr-561/PRVSR-LIVE-PR561-dc8191ec41b8-20260818085151/report.svg",
      "sha256": "c0ffc0d058d01f0112e005dee0ac48ac882be06ac06d106c12b9bdaa3c518fb0"
    },
    "report.txt": {
      "path": "governance/pr_visual_status_archive/grandchallenge/MATH-PROGRAMME/pr-561/PRVSR-LIVE-PR561-dc8191ec41b8-20260818085151/report.txt",
      "sha256": "906168ecc45390d58d730b36ee9fef15087992e7f8d882e489a1ddcb91076054"
    }
  },
  "authority_boundary": {
    "advisory_only": true,
    "new_merge_gate": false,
    "propagation_authority_created": false,
    "visual_is_authoritative": false
  },
  "exact_head_sha": "dc8191ec41b81da59427fc501f81f36c53f555e1",
  "freshness": "CURRENT",
  "operative_state": "CHECKS_PENDING",
  "pr_number": 561,
  "report_id": "PRVSR-LIVE-PR561-dc8191ec41b8-20260818085151",
  "repository": "grandchallenge/MATH-PROGRAMME",
  "schema_version": "1.0.0",
  "source_snapshot_sha256": "366e1df2ba9aad8a0988f501f84d2d850f10073f1a9986080be2ca1e031b2739",
  "target_head_after": "dc8191ec41b81da59427fc501f81f36c53f555e1",
  "target_head_before": "dc8191ec41b81da59427fc501f81f36c53f555e1",
  "target_pr_head_mutated": false,
  "transport_version": "0.1.0-pilot"
}
