{
  "archive_dir": "governance/pr_visual_status_archive/grandchallenge/MATH-PROGRAMME/pr-477/PRVSR-LIVE-PR477-78852c5bafad-20260814143333",
  "artifacts": {
    "report.json": {
      "path": "governance/pr_visual_status_archive/grandchallenge/MATH-PROGRAMME/pr-477/PRVSR-LIVE-PR477-78852c5bafad-20260814143333/report.json",
      "sha256": "a01e4bd8dbd1efcaf5353131ae709ff8cc0e49bf328fceecde92ee3b5711deec"
    },
    "report.svg": {
      "path": "governance/pr_visual_status_archive/grandchallenge/MATH-PROGRAMME/pr-477/PRVSR-LIVE-PR477-78852c5bafad-20260814143333/report.svg",
      "sha256": "50a4af0cf3d1d35a2b6c47cff8f0ac5b5767b7bf52faee5d864c7d0a75cf02e5"
    },
    "report.txt": {
      "path": "governance/pr_visual_status_archive/grandchallenge/MATH-PROGRAMME/pr-477/PRVSR-LIVE-PR477-78852c5bafad-20260814143333/report.txt",
      "sha256": "b1add676e0d9baace93b35f8cc88520798dac169d6345a04d60ba7fa7f91235b"
    }
  },
  "authority_boundary": {
    "advisory_only": true,
    "new_merge_gate": false,
    "propagation_authority_created": false,
    "visual_is_authoritative": false
  },
  "exact_head_sha": "78852c5bafadcd6eb1c44e8f80383218b58e7a9c",
  "freshness": "CURRENT",
  "operative_state": "CHECKS_PENDING",
  "pr_number": 477,
  "report_id": "PRVSR-LIVE-PR477-78852c5bafad-20260814143333",
  "repository": "grandchallenge/MATH-PROGRAMME",
  "schema_version": "1.0.0",
  "source_snapshot_sha256": "baa8657641a53289462dd5d8a85d3813e2f2d1f5366a67d0d9070a6e46db4ada",
  "target_head_after": "78852c5bafadcd6eb1c44e8f80383218b58e7a9c",
  "target_head_before": "78852c5bafadcd6eb1c44e8f80383218b58e7a9c",
  "target_pr_head_mutated": false,
  "transport_version": "0.1.0-pilot"
}
