{
  "archive_dir": "governance/pr_visual_status_archive/grandchallenge/MATH-PROGRAMME/pr-966/PRVSR-LIVE-PR966-ad3b604355d3-20260919100002",
  "artifacts": {
    "report.json": {
      "path": "governance/pr_visual_status_archive/grandchallenge/MATH-PROGRAMME/pr-966/PRVSR-LIVE-PR966-ad3b604355d3-20260919100002/report.json",
      "sha256": "c598896b269e112ec57f996f6aad42c6af335a72d04a0ca3c22e046e91616b7d"
    },
    "report.svg": {
      "path": "governance/pr_visual_status_archive/grandchallenge/MATH-PROGRAMME/pr-966/PRVSR-LIVE-PR966-ad3b604355d3-20260919100002/report.svg",
      "sha256": "b8aead5e30b71a63f7fbb0fa90f1f94947e639dbebd39b219e541d9fc2841f88"
    },
    "report.txt": {
      "path": "governance/pr_visual_status_archive/grandchallenge/MATH-PROGRAMME/pr-966/PRVSR-LIVE-PR966-ad3b604355d3-20260919100002/report.txt",
      "sha256": "45eb5379cab86f0b7009d7826407efc69b1c024a19f42e6b91245c803f1e7836"
    }
  },
  "authority_boundary": {
    "advisory_only": true,
    "new_merge_gate": false,
    "propagation_authority_created": false,
    "visual_is_authoritative": false
  },
  "exact_head_sha": "ad3b604355d3c3e337a5ef843584dd6aabcc7bdb",
  "freshness": "CURRENT",
  "operative_state": "BLOCKED",
  "pr_number": 966,
  "report_id": "PRVSR-LIVE-PR966-ad3b604355d3-20260919100002",
  "repository": "grandchallenge/MATH-PROGRAMME",
  "schema_version": "1.0.0",
  "source_snapshot_sha256": "1193eb5494409f23a6a005de64c2c1b3dedba3b7fea82ed4c69ced620da7dcd0",
  "target_head_after": "ad3b604355d3c3e337a5ef843584dd6aabcc7bdb",
  "target_head_before": "ad3b604355d3c3e337a5ef843584dd6aabcc7bdb",
  "target_pr_head_mutated": false,
  "transport_version": "0.1.0-pilot"
}
