{
  "archive_dir": "governance/pr_visual_status_archive/grandchallenge/MATH-PROGRAMME/pr-1029/PRVSR-LIVE-PR1029-469866a21195-20260919092101",
  "artifacts": {
    "report.json": {
      "path": "governance/pr_visual_status_archive/grandchallenge/MATH-PROGRAMME/pr-1029/PRVSR-LIVE-PR1029-469866a21195-20260919092101/report.json",
      "sha256": "729d3cb322e223fe5af2b09a5885f153c612c07cc5cfe361feb6e281d212d8aa"
    },
    "report.svg": {
      "path": "governance/pr_visual_status_archive/grandchallenge/MATH-PROGRAMME/pr-1029/PRVSR-LIVE-PR1029-469866a21195-20260919092101/report.svg",
      "sha256": "e433a5c07d8c90c637c5177f82fb239c0a25b27c738a8e3f906ff9de8c9ad29b"
    },
    "report.txt": {
      "path": "governance/pr_visual_status_archive/grandchallenge/MATH-PROGRAMME/pr-1029/PRVSR-LIVE-PR1029-469866a21195-20260919092101/report.txt",
      "sha256": "f8fa9f406aae20705af3acc2693477a725f50dfb04f42dae963feb916959a21d"
    }
  },
  "authority_boundary": {
    "advisory_only": true,
    "new_merge_gate": false,
    "propagation_authority_created": false,
    "visual_is_authoritative": false
  },
  "exact_head_sha": "469866a21195c94bfe6b96b05a9c64c5a8dec4c0",
  "freshness": "CURRENT",
  "operative_state": "CHECKS_PENDING",
  "pr_number": 1029,
  "report_id": "PRVSR-LIVE-PR1029-469866a21195-20260919092101",
  "repository": "grandchallenge/MATH-PROGRAMME",
  "schema_version": "1.0.0",
  "source_snapshot_sha256": "6f7265ae1864210820c611c2aad0f008c472af419dd3893d760b90e0761fac4a",
  "target_head_after": "469866a21195c94bfe6b96b05a9c64c5a8dec4c0",
  "target_head_before": "469866a21195c94bfe6b96b05a9c64c5a8dec4c0",
  "target_pr_head_mutated": false,
  "transport_version": "0.1.0-pilot"
}
