{
  "archive_dir": "governance/pr_visual_status_archive/grandchallenge/MATH-PROGRAMME/pr-1253/PRVSR-LIVE-PR1253-e66c1cf555b3-20261009095003",
  "artifacts": {
    "report.json": {
      "path": "governance/pr_visual_status_archive/grandchallenge/MATH-PROGRAMME/pr-1253/PRVSR-LIVE-PR1253-e66c1cf555b3-20261009095003/report.json",
      "sha256": "cedfabf822810b6abc97a8c3e084cea278b493368051227b67f9859c9707a697"
    },
    "report.svg": {
      "path": "governance/pr_visual_status_archive/grandchallenge/MATH-PROGRAMME/pr-1253/PRVSR-LIVE-PR1253-e66c1cf555b3-20261009095003/report.svg",
      "sha256": "a35a10d215e76931174d6f3812e087a6544a807e270171786a51c071a4fe77e4"
    },
    "report.txt": {
      "path": "governance/pr_visual_status_archive/grandchallenge/MATH-PROGRAMME/pr-1253/PRVSR-LIVE-PR1253-e66c1cf555b3-20261009095003/report.txt",
      "sha256": "25c4a2e36e09a8ca68c298c8e8e0446ab2ff28e7d9cdf8c6c99ba554e69d3ae8"
    }
  },
  "authority_boundary": {
    "advisory_only": true,
    "new_merge_gate": false,
    "propagation_authority_created": false,
    "visual_is_authoritative": false
  },
  "exact_head_sha": "e66c1cf555b3cfa77320abc0d306d7671b706de2",
  "freshness": "CURRENT",
  "operative_state": "CHECKS_PENDING",
  "pr_number": 1253,
  "report_id": "PRVSR-LIVE-PR1253-e66c1cf555b3-20261009095003",
  "repository": "grandchallenge/MATH-PROGRAMME",
  "schema_version": "1.0.0",
  "source_snapshot_sha256": "3cfd925140fb0850fee4fb29fa653512f8696ee499f12d51bb071b2cf012a4b8",
  "target_head_after": "e66c1cf555b3cfa77320abc0d306d7671b706de2",
  "target_head_before": "e66c1cf555b3cfa77320abc0d306d7671b706de2",
  "target_pr_head_mutated": false,
  "transport_version": "0.1.0-pilot"
}
